{
  "version": "appc-0.1",
  "passport_id": "appc:8f85b2e6-cc6f-4b18-a90a-fb7b80f0842c",
  "subject": {
    "root_id": "did:key:z6MknExampleRootKey",
    "public_alias": "agent:public:ops-reviewer-01"
  },
  "controller": {
    "id": "org:example:store-ops",
    "type": "organization"
  },
  "issuer": {
    "id": "issuer:example:passport-authority"
  },
  "assurance_level": "AL2",
  "capabilities": {
    "self_declared": [
      "code_review",
      "report_generation"
    ],
    "verified": [
      "pii_read_redacted_only"
    ],
    "observed": [
      "success_rate:report_generation>=0.96"
    ]
  },
  "status_ref": "https://status.example/passports/appc:8f85b2e6-cc6f-4b18-a90a-fb7b80f0842c",
  "valid_from": "2026-04-15T00:00:00Z",
  "valid_until": "2027-04-15T00:00:00Z"
}
